{
  "id": "AAMkAGI2THVSAAA=",
  "blobId": "blob-AAMkAGI2THVSAAA=",
  "threadId": "AAQkAGI2TAABj5P2QAAA=",
  "messageId": [
    "<CABcD1E2FgH3IjK4LmN5OpQ6RsT7UvW8XyZ9@mail.company.com>"
  ],
  "inReplyTo": [
    "<CAAbC9D8EfG7HiJ6KlM4NnO3PpQ2RrS1TuV0WxY8@mail.example.com>"
  ],
  "references": [
    "<CAAbC9D8EfG7HiJ6KlM4NnO3PpQ2RrS1TuV0WxY8@mail.example.com>"
  ],
  "sender": [
    {
      "name": "Sarah Smith",
      "email": "sarah.smith@company.com"
    }
  ],
  "from": [
    {
      "name": "Sarah Smith",
      "email": "sarah.smith@company.com"
    }
  ],
  "to": [
    {
      "name": "John Doe",
      "email": "john.doe@example.com"
    }
  ],
  "cc": [
    {
      "name": "Jane Admin",
      "email": "jane.admin@example.com"
    }
  ],
  "bcc": null,
  "replyTo": null,
  "subject": "Follow-up: Q4 Report Request",
  "sentAt": "2023-11-09T20:00:00Z",
  "receivedAt": "2023-11-09T20:00:15Z",
  "size": 272,
  "preview": "Hi John, Just wanted to follow up on our meeting yesterday. Can you send over the Q4 report when you get a chance? Thanks, Sarah",
  "bodyStructure": {
    "partId": "0",
    "blobId": "blob-AAMkAGI2THVSAAA=-body",
    "size": 272,
    "name": null,
    "type": "text/html",
    "charset": "UTF-8",
    "disposition": null,
    "cid": null,
    "language": null,
    "location": null,
    "subParts": null,
    "headers": [
      {
        "name": "Content-Type",
        "value": "text/html; charset=UTF-8"
      }
    ]
  },
  "bodyValues": {
    "0": {
      "value": "<html><head><meta http-equiv=\"Content-Type\" content=\"text/html; charset=utf-8\"></head><body><div dir=\"ltr\">Hi John,<br><br>Just wanted to follow up on our meeting yesterday. Can you send over the Q4 report when you get a chance?<br><br>Thanks,<br>Sarah</div></body></html>",
      "isEncodingProblem": false,
      "isTruncated": false
    }
  },
  "textBody": [],
  "htmlBody": [
    {
      "partId": "0",
      "blobId": "blob-AAMkAGI2THVSAAA=-body",
      "size": 272,
      "name": null,
      "type": "text/html",
      "charset": "UTF-8",
      "disposition": null,
      "cid": null,
      "language": null,
      "location": null,
      "subParts": null,
      "headers": [
        {
          "name": "Content-Type",
          "value": "text/html; charset=UTF-8"
        }
      ]
    }
  ],
  "attachments": [],
  "hasAttachment": false,
  "headers": [
    {
      "name": "Received",
      "value": "from mail.company.com by outlook.office365.com"
    },
    {
      "name": "Return-Path",
      "value": "sarah.smith@company.com"
    },
    {
      "name": "From",
      "value": "Sarah Smith <sarah.smith@company.com>"
    },
    {
      "name": "To",
      "value": "John Doe <john.doe@example.com>"
    },
    {
      "name": "Cc",
      "value": "Jane Admin <jane.admin@example.com>"
    },
    {
      "name": "Subject",
      "value": "Follow-up: Q4 Report Request"
    },
    {
      "name": "Date",
      "value": "Thu, 9 Nov 2023 12:00:00 -0800"
    },
    {
      "name": "Message-ID",
      "value": "<CABcD1E2FgH3IjK4LmN5OpQ6RsT7UvW8XyZ9@mail.company.com>"
    },
    {
      "name": "In-Reply-To",
      "value": "<CAAbC9D8EfG7HiJ6KlM4NnO3PpQ2RrS1TuV0WxY8@mail.example.com>"
    },
    {
      "name": "References",
      "value": "<CAAbC9D8EfG7HiJ6KlM4NnO3PpQ2RrS1TuV0WxY8@mail.example.com>"
    },
    {
      "name": "Content-Type",
      "value": "text/html; charset=utf-8"
    },
    {
      "name": "MIME-Version",
      "value": "1.0"
    }
  ],
  "keywords": {
    "$seen": true,
    "$flagged": false,
    "$answered": false,
    "$draft": false
  },
  "mailboxIds": {
    "inbox": true,
    "Work": true,
    "Important": true
  }
}
