{
  "id": "18c5f2e8a9b4d7f3",
  "blobId": "blob-18c5f2e8a9b4d7f3",
  "threadId": "18c5f2e8a9b4d7f3",
  "messageId": [
    "<CABcD1E2FgH3IjK4LmN5OpQ6RsT7UvW8XyZ9@mail.company.com>"
  ],
  "inReplyTo": [
    "<CAAbC9D8EfG7HiJ6KlM4NnO3PpQ2RrS1TuV0WxY8@mail.example.com>"
  ],
  "references": [
    "<CAAbC9D8EfG7HiJ6KlM4NnO3PpQ2RrS1TuV0WxY8@mail.example.com>",
    "<CABcD1E2FgH3IjK4LmN5OpQ6RsT7UvW8XyZ9@mail.company.com>"
  ],
  "sender": null,
  "from": [
    {
      "name": "Sarah Smith",
      "email": "sarah.smith@company.com"
    }
  ],
  "to": [
    {
      "name": "John Doe",
      "email": "john.doe@example.com"
    }
  ],
  "cc": [
    {
      "name": "Jane Admin",
      "email": "jane.admin@example.com"
    }
  ],
  "bcc": null,
  "replyTo": null,
  "subject": "Follow-up: Q4 Report Request",
  "sentAt": "2023-11-09T16:00:00.000Z",
  "receivedAt": "2023-11-09T16:00:00.000Z",
  "size": 4521,
  "preview": "Hi John, Just wanted to follow up on our meeting yesterday. Can you send over the Q4 report when you get a chance? Thanks, Sarah",
  "bodyStructure": {
    "partId": "",
    "blobId": null,
    "size": 0,
    "name": null,
    "type": "multipart/alternative",
    "disposition": null,
    "language": null,
    "subParts": [
      {
        "partId": "0",
        "blobId": "blob-18c5f2e8a9b4d7f3-0",
        "size": 158,
        "name": null,
        "type": "text/plain",
        "charset": "UTF-8",
        "disposition": null,
        "language": null,
        "subParts": null,
        "headers": [
          {
            "name": "Content-Type",
            "value": "text/plain; charset=\"UTF-8\""
          }
        ]
      },
      {
        "partId": "1",
        "blobId": "blob-18c5f2e8a9b4d7f3-1",
        "size": 287,
        "name": null,
        "type": "text/html",
        "charset": "UTF-8",
        "disposition": null,
        "language": null,
        "subParts": null,
        "headers": [
          {
            "name": "Content-Type",
            "value": "text/html; charset=\"UTF-8\""
          }
        ]
      }
    ],
    "headers": [
      {
        "name": "Delivered-To",
        "value": "john.doe@example.com"
      },
      {
        "name": "Received",
        "value": "by 2002:a05:6214:2889:b0:63f:8c5a:d4e8 with SMTP id fc9-20020a056214288900b0063f8c5ad4e8mr1234567qvb.14.1699545600000; Thu, 09 Nov 2023 12:00:00 -0800 (PST)"
      },
      {
        "name": "Return-Path",
        "value": "<sarah.smith@company.com>"
      },
      {
        "name": "From",
        "value": "Sarah Smith <sarah.smith@company.com>"
      },
      {
        "name": "To",
        "value": "John Doe <john.doe@example.com>"
      },
      {
        "name": "Cc",
        "value": "Jane Admin <jane.admin@example.com>"
      },
      {
        "name": "Subject",
        "value": "Follow-up: Q4 Report Request"
      },
      {
        "name": "Date",
        "value": "Thu, 9 Nov 2023 12:00:00 -0800"
      },
      {
        "name": "Message-ID",
        "value": "<CABcD1E2FgH3IjK4LmN5OpQ6RsT7UvW8XyZ9@mail.company.com>"
      },
      {
        "name": "In-Reply-To",
        "value": "<CAAbC9D8EfG7HiJ6KlM4NnO3PpQ2RrS1TuV0WxY8@mail.example.com>"
      },
      {
        "name": "References",
        "value": "<CAAbC9D8EfG7HiJ6KlM4NnO3PpQ2RrS1TuV0WxY8@mail.example.com> <CABcD1E2FgH3IjK4LmN5OpQ6RsT7UvW8XyZ9@mail.company.com>"
      },
      {
        "name": "MIME-Version",
        "value": "1.0"
      },
      {
        "name": "Content-Type",
        "value": "multipart/alternative; boundary=\"000000000000a1b2c3d4e5f6\""
      }
    ]
  },
  "bodyValues": {
    "0": {
      "value": "Hi John,\n\nJust wanted to follow up on our meeting yesterday. Can you send over the Q4 report when you get a chance?\n\nThanks,\nSarah",
      "isEncodingProblem": false,
      "isTruncated": false
    },
    "1": {
      "value": "<div dir=\"ltr\">Hi John,\\x3cbr\\x3e\\x3cbr\\x3eJust wanted to follow up on our meeting yesterday. Can you send over the Q4 report when you get a chance?\\x3cbr\\x3e\\x3cbr\\x3eThanks,\\x3cbr\\x3eSanah\\x3c/div\\x3e",
      "isEncodingProblem": false,
      "isTruncated": false
    }
  },
  "textBody": [
    {
      "partId": "0",
      "blobId": "blob-18c5f2e8a9b4d7f3-0",
      "size": 158,
      "name": null,
      "type": "text/plain",
      "charset": "UTF-8",
      "disposition": null,
      "language": null,
      "subParts": null,
      "headers": [
        {
          "name": "Content-Type",
          "value": "text/plain; charset=\"UTF-8\""
        }
      ]
    }
  ],
  "htmlBody": [
    {
      "partId": "1",
      "blobId": "blob-18c5f2e8a9b4d7f3-1",
      "size": 287,
      "name": null,
      "type": "text/html",
      "charset": "UTF-8",
      "disposition": null,
      "language": null,
      "subParts": null,
      "headers": [
        {
          "name": "Content-Type",
          "value": "text/html; charset=\"UTF-8\""
        }
      ]
    }
  ],
  "attachments": [],
  "hasAttachment": false,
  "headers": [
    {
      "name": "Delivered-To",
      "value": "john.doe@example.com"
    },
    {
      "name": "Received",
      "value": "by 2002:a05:6214:2889:b0:63f:8c5a:d4e8 with SMTP id fc9-20020a056214288900b0063f8c5ad4e8mr1234567qvb.14.1699545600000; Thu, 09 Nov 2023 12:00:00 -0800 (PST)"
    },
    {
      "name": "Return-Path",
      "value": "<sarah.smith@company.com>"
    },
    {
      "name": "From",
      "value": "Sarah Smith <sarah.smith@company.com>"
    },
    {
      "name": "To",
      "value": "John Doe <john.doe@example.com>"
    },
    {
      "name": "Cc",
      "value": "Jane Admin <jane.admin@example.com>"
    },
    {
      "name": "Subject",
      "value": "Follow-up: Q4 Report Request"
    },
    {
      "name": "Date",
      "value": "Thu, 9 Nov 2023 12:00:00 -0800"
    },
    {
      "name": "Message-ID",
      "value": "<CABcD1E2FgH3IjK4LmN5OpQ6RsT7UvW8XyZ9@mail.company.com>"
    },
    {
      "name": "In-Reply-To",
      "value": "<CAAbC9D8EfG7HiJ6KlM4NnO3PpQ2RrS1TuV0WxY8@mail.example.com>"
    },
    {
      "name": "References",
      "value": "<CAAbC9D8EfG7HiJ6KlM4NnO3PpQ2RrS1TuV0WxY8@mail.example.com> <CABcD1E2FgH3IjK4LmN5OpQ6RsT7UvW8XyZ9@mail.company.com>"
    },
    {
      "name": "MIME-Version",
      "value": "1.0"
    },
    {
      "name": "Content-Type",
      "value": "multipart/alternative; boundary=\"000000000000a1b2c3d4e5f6\""
    }
  ],
  "keywords": {
    "$seen": true,
    "$flagged": false,
    "$answered": false,
    "$draft": false
  },
  "mailboxIds": {
    "INBOX": true,
    "IMPORTANT": true,
    "CATEGORY_PERSONAL": true
  }
}
